{
    "type": "ps-nagios-http",
    "name": "HTTP",
    "description": "Queries an esmond MA for HTTP tests and alarms on time reported by test by default (can look at other parameters using the jq option)",
    "requires": {
        "test-type": ["http"],
        "archive-type": ["esmond"]
    },
    "archive-accessor": {
        "script": [ ".url" ]
    },
    "status-labels": {
        "ok": "Value {% check.params.label-ok-symbol %} {% check.warning %}{% check.params.units %}",
        "warning": "Value {% label-warning-symbol %} {% check.params.units %}",
        "critical": "Value {% label-critical-symbol %} {% check.params.units %}",
        "notrun": "Check has not run yet",
        "unknown": "Unable to find test data"
    },
    "defaults": {
        "check-interval": "PT1H",
        "warning-threshold": "1",
        "critical-threshold": "2",
        "retry-attempts": 1,
        "retry-interval": "PT15M",
        "report-yaml-file": "",
        "timeout": "PT60S",
        "params": {
            "time-range": "86400",
            "tool": "",
            "event-type": "pscheduler-raw",
            "function": "",
            "jq": ".time",
            "units": "s",
            "label-ok-symbol": "<",
            "label-warning-symbol": ">=",
            "label-critical-symbol": ">="
        }
    },
    "vars": {
        "test_url": { 
            "script": [
                ".test.spec.url"
            ]
        }
    },
    "command": "/usr/lib64/nagios/plugins/check_esmond",
    "command-opts": {
        "--url": {
            "required": true,
            "condition": "{% ma_url_forward %}",
            "arg": "{% ma_url_forward %}"
        },
        "--event-type": {
            "condition": "{% check.params.event-type %}",
            "arg": "{% check.params.event-type %}"
        },
        "--measurement-agent": {
            "condition": "{% row %}",
            "arg": "{% row %}"
        },
        "--function": {
            "condition": "{% check.params.function %}",
            "arg": "{% check.params.function %}"
        },
        "--jq": {
            "condition": "{% check.params.jq %}",
            "arg": "{% check.params.jq %}"
        },
        "--time-range": {
            "required": true,
            "condition": "{% check.params.time-range %}",
            "arg": "{% check.params.time-range %}"
        },
        "--warning": {
            "required": true,
            "condition": "{% check.warning %}",
            "arg": "{% check.warning %}"
        },
        "--critical": {
            "required": true,
            "condition": "{% check.critical %}",
            "arg": "{% check.critical %}"
        },
        "--tool-name": {
            "condition": "{% check.params.tool %}",
            "arg": "{% check.params.tool %}"
        },
        "--timeout": {
            "condition": "{% check.timeout.seconds %}",
            "arg": "{% check.timeout.seconds %}"
        },
        "--metadata-params": {
            "condition": "{% check.vars.test_url %}",
            "arg": "pscheduler-http-url={% check.vars.test_url %}"
        }
    }
}