{
    "type": "ps-nagios-dns",
    "name": "DNS",
    "description": "Queries an esmond MA for HTTP tests and alarms on time reported by test by default (can look at other parameters using the jq option)",
    "requires": {
        "test-type": ["dns"],
        "archive-type": ["esmond", "http"]
    },
    "archive-accessor": {
        "script": [ 
            ". | if (._meta.esmond_url != null) then ",
            "   ._meta.esmond_url ",
            "else ",
            "   .data.url ",
            "end"
        ]
    },
    "status-labels": {
        "ok": "Value {% check.params.label-ok-symbol %} {% check.warning %}{% check.params.units %}",
        "warning": "Value {% check.params.label-warning-symbol %} {% check.warning %}{% check.params.units %}",
        "critical": "Value {% check.params.label-critical-symbol %} {% check.critical %}{% check.params.units %}",
        "notrun": "Check has not run yet",
        "unknown": "Unable to find test data"
    },
    "defaults": {
        "check-interval": "PT1H",
        "warning-threshold": "1",
        "critical-threshold": "2",
        "retry-attempts": 1,
        "retry-interval": "PT15M",
        "report-yaml-file": "",
        "timeout": "PT60S",
        "params": {
            "time-range": "86400",
            "tool": "",
            "function": "",
            "jq": ".time",
            "use-host": "",
            "units": "s",
            "scale": "",
            "label-ok-symbol": "<",
            "label-warning-symbol": ">=",
            "label-critical-symbol": ">="
        }
    },
    "vars": {
        "host": { 
            "script": [
                ".test.spec.host"
            ]
        },
        "record": { 
            "script": [
                ".test.spec.record"
            ]
        },
        "query": { 
            "script": [
                ".test.spec.query"
            ]
        },
        "nameserver": { 
            "script": [
                ".test.spec.nameserver"
            ]
        }
    },
    "command": "/usr/lib64/nagios/plugins/check_esmond",
    "command-opts": {
        "--url": {
            "required": true,
            "condition": "{% ma_url_forward %}",
            "arg": "{% ma_url_forward %}"
        },
        "--event-type": {
            "condition": "1",
            "arg": "pscheduler-raw"
        },
        "--metadata-params__type": {
            "condition": "1",
            "arg": "pscheduler-test-type dns"
        },
        "--measurement-agent": {
            "condition": "{% row %}",
            "arg": "{% row %}"
        },
        "--metadata-params__record": {
            "condition": "{% check.vars.record %}",
            "arg": "pscheduler-dns-record {% check.vars.record %}"
        },
        "--metadata-params__query": {
            "condition": "{% check.vars.query %}",
            "arg": "pscheduler-dns-query {% check.vars.query %}"
        },
        "--metadata-params__nameserver": {
            "condition": "{% check.vars.nameserver %}",
            "arg": "pscheduler-dns-nameserver {% check.vars.nameserver %}"
        },
        "--metadata-params__host": {
            "condition": "{% check.params.use-host %}",
            "arg": "pscheduler-dns-host {% check.vars.host %}"
        },
        "--function": {
            "condition": "{% check.params.function %}",
            "arg": "{% check.params.function %}"
        },
        "--jq": {
            "condition": "{% check.params.jq %}",
            "arg": "{% check.params.jq %}"
        },
        "--time-range": {
            "required": true,
            "condition": "{% check.params.time-range %}",
            "arg": "{% check.params.time-range %}"
        },
        "--warning": {
            "required": true,
            "condition": "{% check.warning %}",
            "arg": "{% check.warning %}"
        },
        "--critical": {
            "required": true,
            "condition": "{% check.critical %}",
            "arg": "{% check.critical %}"
        },
        "--tool-name": {
            "condition": "{% check.params.tool %}",
            "arg": "{% check.params.tool %}"
        },
        "--timeout": {
            "condition": "{% check.timeout.seconds %}",
            "arg": "{% check.timeout.seconds %}"
        },
        "--units": {
            "condition": "{% check.params.units %}",
            "arg": "{% check.params.units %}"
        },
        "--scale": {
            "condition": "{% check.params.scale %}",
            "arg": "{% check.params.scale %}"
        }        
    }
}
